{
  "indexFormat": 1,
  "moduleId": "app.ui.examples",
  "repository": "JayConstruct/xudian",
  "versions": [
    {
      "version": "1.1.1",
      "manifest": {
        "id": "app.ui.examples",
        "name": "UI 示例",
        "version": "1.1.1",
        "hostApi": "^1.7.0",
        "dataVersion": 1,
        "permissions": [
          "ui"
        ],
        "dependencies": [],
        "defaultInstall": false,
        "description": "浏览模块界面组件、布局和交互示例。",
        "author": "JayConstruct"
      },
      "services": [],
      "url": "https://github.com/JayConstruct/xudian/releases/download/modules-2026-10-08/app.ui.examples-1.1.1.xmodule",
      "size": 7148,
      "sha256": "6d070e2eca0bc11fbd59a89ab3ab057e51414fca2f315d4bcc98f16a6ab306ba",
      "signature": null
    },
    {
      "version": "1.1.0",
      "manifest": {
        "id": "app.ui.examples",
        "name": "UI 示例",
        "version": "1.1.0",
        "hostApi": "^1.7.0",
        "dataVersion": 1,
        "permissions": [
          "ui"
        ],
        "dependencies": [],
        "defaultInstall": false
      },
      "services": [],
      "url": "https://github.com/JayConstruct/xudian/releases/download/modules-2026-10-08/app.ui.examples-1.1.0.xmodule",
      "size": 7075,
      "sha256": "d7ed8d57533730ca2aadfb748f9f95e226ce12a02534e85564e2dc6c71352e62",
      "signature": null
    },
    {
      "version": "1.4.1",
      "manifest": {
        "id": "app.ui.examples",
        "name": "UI 示例",
        "version": "1.4.1",
        "hostApi": "^1.15.0",
        "dataVersion": 1,
        "permissions": [
          "ui",
          "clock.today"
        ],
        "dependencies": [],
        "defaultInstall": false,
        "description": "分类浏览真实 UI、控件与动画，查看调用方式并固定常用演示。",
        "author": "JayConstruct"
      },
      "services": [],
      "url": "https://github.com/JayConstruct/xudian/releases/download/modules-20261013-runtime-ui/app.ui.examples-1.4.1.xmodule",
      "size": 14734,
      "sha256": "70b92d480a61c18ccded0b6341c8a64eed740effda877f0cd6224acaed4623ca",
      "signature": null
    },
    {
      "version": "1.4.2",
      "manifest": {
        "id": "app.ui.examples",
        "name": "UI 示例",
        "version": "1.4.2",
        "hostApi": "^1.15.0",
        "dataVersion": 1,
        "permissions": [
          "ui",
          "clock.today"
        ],
        "dependencies": [],
        "defaultInstall": false,
        "description": "分类浏览真实 UI、控件与动画，查看调用方式并固定常用演示。",
        "author": "JayConstruct"
      },
      "services": [],
      "url": "https://github.com/JayConstruct/xudian/releases/download/modules-20261013-planner/app.ui.examples-1.4.2.xmodule",
      "size": 16063,
      "sha256": "f9186446a8c02a4a9b3930a8759e2f989c92c637762d2bc6ac1ac5cb602f64fd",
      "signature": null
    }
  ]
}
